{
  "name": "__PROJECT__-api",
  "tests": ["tests/"],
  "install": ["uv", "sync"],
  "dev": {
    "run": ["uv", "run", "uvicorn", "api.main:app", "--reload"],
    "url": "http://127.0.0.1:8000",
    "readyCheck": "GET /healthz responds 200 with {\"status\": \"ok\"}"
  },
  "gates": [
    {
      "name": "ruff check",
      "kind": "lint",
      "run": ["uv", "run", "ruff", "check", "."]
    },
    {
      "name": "ruff format --check",
      "kind": "format",
      "run": ["uv", "run", "ruff", "format", "--check", "."]
    },
    {
      "name": "mypy",
      "kind": "types",
      "run": ["uv", "run", "mypy"],
      "caveat": "mypy checks only the paths in pyproject.toml's `files`. A new top-level directory is silently unchecked while this stays green."
    },
    {
      "name": "pytest",
      "kind": "test",
      "run": ["uv", "run", "pytest"]
    },
    {
      "name": "contract is current",
      "kind": "build",
      "run": [
        "uv",
        "run",
        "python",
        "scripts/emit_contract.py",
        "--check",
        "contracts/openapi.json"
      ],
      "caveat": "it compares this app's emitted document with the committed one. It cannot tell you whether any client has followed a change -- in a split repository nothing can, until that client pins the new version."
    }
  ],
  "hooks": {
    "gatedPaths": ["src", "tests", "scripts", "contracts"],
    "gatedFiles": ["pyproject.toml", "harness.config.json", ".claude/settings.json"],
    "gatedExtensions": [".py", ".json"],
    "protected": [
      {
        "glob": "uv.lock",
        "why": "regenerate with `uv lock`, never hand-edit",
        "scope": "write"
      },
      {
        "glob": "**/migrations/**",
        "why": "schema migrations are irreversible - a human applies these",
        "scope": "write"
      },
      {
        "glob": "contracts/openapi.json",
        "why": "generated from the handlers; run `uv run python scripts/emit_contract.py contracts/openapi.json` instead of editing it",
        "scope": "write"
      }
    ],
    "formatters": [
      {
        "match": [".py"],
        "run": [
          ["uv", "run", "ruff", "format"],
          ["uv", "run", "ruff", "check", "--fix", "--unfixable", "F401"]
        ]
      }
    ]
  }
}
